Discussed	Authors	Title	Year	Abstract
	Nocera D.D.; Napoli C.D.; Rossi S.	A social-aware smart parking application	2014	The problem of finding parking spaces in big urban areas is one of the unsolved challenges of Smart Cities causing traffic congestion, increased carbon emission and time wasting. Network and sensor technologies available today allow to foresee Smart Cities equipped with applications able to provide real-time information on parking space availability, which can be used to assist motorists in looking for a parking space. In the present work, we propose a smart parking application that relies on the use of software agent negotiation as a mechanism to automate the selection of parking spaces according to the user preferences, but at the same time to take into account city needs in terms of areas motorists should avoid, or car pars occupancy at a specific time. Both city needs and user's preferences are dynamic information managed by the negotiation mechanism at the time a user's request is processed, so providing a dynamic-based selection of a parking space.
1	Monica S.; Bergenti F.	A stochastic model of self-stabilizing cellular automata for consensus formation	2014	In this paper we present a model of the dynamics of an interesting class of stochastic cellular automata. Such automata are variants of automata used for density classification and they are chosen because they can be effectively used to address consensus problems. After introducing the topic and the basic notation, we study the dynamics of such automata by means of simulations with varying periods and neighborhood structures. We use the results of simulations to extrapolate a stochastic model of the dynamics of such automata that can be used to estimate stabilization time.
1	Messina F.; Pappalardo G.; Santoro C.	Designing autonomous robots using GOLEM	2014	In this paper we present a goal model for the design of autonomous robots. A framework is proposed which allows a developer to design the behaviour of a robot in accordance with a rational model, which is conceived to let the autonomous system to mimic the human behaviour. The framework, called GOLEM, is based on the abstractions of goals and sub-goals, which are combined through specific relationships to specify the robot's activities; such activities, assembled together, form the rational behaviour of the autonomous system. The central motivation for the design of our framework is represented by the central issue of integrating full awareness and autonomy. Indeed, in the proposed solution the execution of goals does not obey a pre-fixed sequence; rather, the next goal to achieve is selected, each time, on the basis of an evaluation of its opportunity.
	Sapienza A.; Falcone R.; Castelfranchi C.	Trust on information sources: A theoretical and computation approach	2014	We start from the claim that trust in information sources is just a kind of social trust. We are interested in the fact that the relevance and the trustworthiness of the information acquired by an agent X from a given number of sources strictly depends and derives from the X's trust on each of these sources with respect the kind of that information. In this paper, we analyze the different dimensions of trust in information sources and formalize the degree of subjective certainty or strength of the X's belief P, considering three main factors: the X's trust about P just depending from the X's judgment of the source's competence and reliability; the sources' degree of certainty about P; and the X's degree of trust that P derives from that given source. Finally we present a computational approach based on fuzzy sets.
1	Fortino G.; Zedadra O.; Joueau N.; Seridi H.	A decentralized ant colony foraging model using only stigmergic communication	2014	This paper addresses the problem of foraging by a coordinated team of robots. This coordination is achieved by markers deposited by robots. In this paper, we present a novel decentralized behavioral model for multi robot foraging named cooperative c-marking agent model. In such model, each robot makes a decision according to the affluence of resource locations, either to spread information on a large scale in order to attract more agents or the opposite. Simulation results show that the proposed model outperforms the well-known c-marking agent model.
	Rosaci D.; Sarné G.M.L.	An agent-based architecture to recommend educational video	2014	Agent-based recommender systems are tools able to assist users' choices with suggestions coming closest to their orientations. In this context, it is relevant to identify those users that are the most similar to the target user in order to require them suitable suggestions. However, particularly when we deal with video contents for e-Learning, it should be appropriate also to consider (i) recommendations coming from those students resulted the most effective in suggesting video and (ii) the effects of the device currently exploited. To address such issues in a multimedia scenario, we propose a multi-agent trust based recommender architecture, called ELSA, appositely conceived to this aim. Some preliminary performed simulations permitted to evaluate our proposal with respect to the other considered agentbased RSs.
	Napoli C.; Pappalardo G.; Tramontana E.	An agent-driven semantical identifier using radial basis neural networks and reinforcement learning	2014	Due to the huge availability of documents in digital form, and the deception possibility raise bound to the essence of digital documents and the way they are spread, the authorship attribution problem has constantly increased its relevance. Nowadays, authorship attribution, for both information retrieval and analysis, has gained great importance in the context of security, trust and copyright preservation. This work proposes an innovative multi-agent driven machine learning technique that has been developed for authorship attribution. By means of a preprocessing for word-grouping and timeperiod related analysis of the common lexicon, we determine a bias reference level for the recurrence frequency of the words within analysed texts, and then train a Radial Basis Neural Networks (RBPNN)-based classifier to identify the correct author. The main advantage of the proposed approach lies in the generality of the semantic analysis, which can be applied to different contexts and lexical domains, without requiring any modification. Moreover, the proposed system is able to incorporate an external input, meant to tune the classifier, and then self-adjust by means of continuous learning reinforcement.
	Cervone F.; Sica V.; Staffa M.; Tamburro A.; Rossi S.	Comparing a social robot and a mobile application for movie recommendation: A pilot study	2015	Social robots can be used as interfaces to provide recommendations to users. While a vast literature compares the user's behavior when interacting with a robot with respect to a virtual agent, in this paper, we conduct a first evaluation on how the user's choices are affected if the recommendations are provided respectively by a mobile application or by social robots with different degree of interaction capabilities. This pilot study shows that the sole embodiment condition of the robot does not imply significant changes in the users' choices that prefer to interact with the mobile application. However, the adoption of additional communication channels such as gestures, gaze and voice pitch, which change accordingly to the suggested movie genre, improves the users acceptability.
	Woźniak M.	Recent possibilities of intelligent agents in distributed systems	2015	The article is to discuss recent advances in various aspects of intelligent agents that perform control functions in workflow management and data processing. Cloud-Computing brings various possibilities of novel approach to data management and efficient computer systems, however the process of distribution must be managed not only to increase efficiency but also lower energy consumption. This is a task for intelligent agents, that can play crucial role in modern computer science. In this article recent possibilities for these type of computer systems are discussed.
	Barile F.; Rossi A.; Staffa M.; Di Napoli C.; Rossi S.	A market mechanism for qos-aware multi-robot task allocation	2015	Market mechanisms, such as auctions and negotiations, are often used for efficient task allocation in multi-robot domains where tasks are characterized by quality parameters that are related to the way the task is executed depending on the specific robot capabilities. In these cases, usually robots negotiate their respective assignments in order to optimize task distribution according to their own utility function. In this work, a market-based negotiation mechanism is proposed to allocate tasks to a set of robots by taking into account end-to-end requirements that the complete allocation should meet in terms of the considered quality parameters. Negotiation takes place on these parameters that are considered goods to be traded by the individual robots, depending on their strategies, so that they can successfully negotiate to obtain the task allocation.
	Monica S.; Bergenti F.	Location-aware JADE agents in indoor scenarios	2015	This paper presents a novel JADE add-on that enables the implementation of location-aware agents by interfacing an underlying ranging technology which provides accurate distance measures both indoor and outdoor. First, the paper motivates the work and it presents the features and the architecture of the add-on. Then, the paper provides a detailed description of the implemented localization algorithms and it validates them in an indoor scenario. The experimental results show that accurate indoor localization can be achieved and that the presented addon can be used to support location-aware agents with sufficient accuracy for targeted educational and ludic applications.
	Crociani L.; Invernizzi A.; Vizzari G.	A hybrid agent architecture for endowing floor field pedestrian models with tactical level decisions	2015	For a comprehensive modeling of pedestrian dynamics in real-world scenarios the consideration of tactical level decisions in addition to operational ones is necessary. This paper presents a hybrid agent architecture employing a Floor Field approach at the operational level but granting agents an abstract representation of the simulated environment. The paper briefly presents the environmental model and hybrid agent architecture based on the floor field approach, then a sample practical application in a simple case study is also presented to show how it allows specifying abstract behavioural scripts for different groups of agents.
	Fornaia A.; Napoli C.; Pappalardo G.; Tramontana E.	An AO system for OO-GPU programming	2015	Recent technologies, like general purpose computing GPU, have a major limitation consisting in the difficulties that developers face when implementing parallel code using device-oriented languages. This paper aims to assist developers by automatically producing snippets of code handling GPU-oriented tasks. Our proposed approach is based on Aspect-Oriented-Programming and generates modules in CUDA C compliant code, which are encapsulated and connected by means of JNI. By means of a set of predefined functions we separate the application code from device-dependent concerns, including device memory allocation and management. Moreover, bandwidth utilisation and cores occupancy is automatically handled in order to minimise the overhead caused by host to device communications and the computational imbalance, which often tampers with the effective speedup of a GPU parallelised code.
	Monica S.; Bergenti F.	Simulations of opinion formation in multi-agent systems using kinetic theory	2015	In this paper we formulate the problem of opinion formation using a physical metaphore. We consider a multiagent system where each agent is associated with an opinion and interacts with any other agent. Interpreting the agents as the molecules of a gas, we model the evolution of opinion in the system according to a kinetic model based on the analysis of interactions among agents. From a microscopic description of each interaction between two agents, we derive the stationary profiles of the opinion under given assumption. Results show that, depending on the average opinion and on the parameters of the model, different profiles can be found, but all stationary profiles are characterized by the presence just of one or two maxima. Analytic results are confirmed by simulations shown in the last part of the paper.
	Amato A.; Scialdone M.; Venticinque S.	An application of learning agents to smart energy domains	2015	The main requirement for building an Internet of Things is the definition of smart objects in which it needs to put intelligence. The pervasive deployment of smart objects will add value to applications by capabilities of communication, negotiation, learning and distributed reasoning. In this paper we investigate how the paradigm shift from objects to agents is the driver for developing these capabilities by a case study in the context of Smart Energy application domain. In fact the paradigm shift we are seeing in these years is to consider the electricity network like an Internet of Energy, where each and every electrical device and generator will be connected in a network and able to communicate data and receive and react in real time to events and stimuli that arrive from other devices or from the grid: a scattered network of sensors, actuators, communication nodes, systems control and monitoring. Here we present the learning-based approach for power management in smart grids providing an agent-oriented modeling of the energy market. The main issue we focus on is a reasonable compromise between the resolution of the consuming profile representation and the performance and real time requirements of the system.
1	Cossentino M.; Lodato C.; Lopes S.; Sabatucci L.	MUSA: A middleware for user-driven service adaptation	2015	One of the current challenges of Service Oriented Engineering is to provide instruments for dealing with dynamic and unpredictable environments and changing user requirements. Traditional approaches based on static workflows provide little support for adapting at runtime the flow of activities. MUSA (Middleware for User-driven Service Adaptation) is a holonic multi-agent system for the self-adaptive composition and orchestration of services in a distributed environment.
1	Crociani L.; Piazzoni A.; Vizzari G.	Adaptive hybrid agents for tactical decisions in pedestrian environments	2015	This paper presents a hybrid agent architecture for modeling different types of decisions in a pedestrian simulation system. In particular, the present work focuses on tactical level decisions that are essentially related to the choice of a route to follow in an environment comprising several rooms connected by openings. These decisions are then enacted at the operational level by mean of a floor-field based model, in a discrete simulation approach. The described model allows the agent taking decisions based on a static a-priori knowledge of the environment and dynamic perceivable information on the current level of crowdedness of visible path alternatives. The paper presents the model formally, motivating the adopted choices with reference to the relevant state of the art. The model is also experimented in benchmark scenarios showing the adequacy in providing adaptiveness to the contextual situation.
	Bergenti F.; Iotti E.; Poggi A.	Outline of a formalization of JADE multi-agent systems	2015	This paper proposes a formalization of JADE agents and multi-agent systems based on transition systems. The first section introduces the aims and scope of the research and it focuses the content of the paper. The second section enumerates the abstractions and the structures used in the formalization. Successively, third section presents the formal semantics of the parts of a JADE-based source code that are involved in the management of (i) the life cycle of agents and (ii) the behaviours of agents. Fourth section shows a very simple JADE agent and it exemplifies the use of the proposed transition system. Finally, a brief recapitulation of the work concludes the paper.
	Omicini A.; Zambonelli F.	Coordination of large-scale socio-technical systems: Challenges and research directions	2015	Most of the emerging software-intensive systems nowadays are very large-scale ones, and inherently socio-technical. In this position paper, we argue that the peculiar features of such emerging systems (up to millions of interacting components, lacking central control, mixing humans and artificial components) call for novel approaches to coordinate the overall activities and functionalities. Accordingly, we discuss the key challenges to be faced by research in coordination models and technologies, and try to sketch some promising research directions.
	Ancona D.; Briola D.; Mascardi V.	Protocols with exceptions, timeouts, and handlers: A uniform framework for monitoring fail-uncontrolled and ambient intelligence systems	2015	This paper describes an approach for designing, formalizing and implementing sentinels that detect errors in fail-uncontrolled multiagent systems, and controllers that identify particular situations in ambient intelligence (AmI) systems. The formalism we use for representing the expected patterns of actions along with exceptions, timeouts, and their handlers, is that of constrained global types extended with features for dealing with these new constructs. We provide the syntax and semantics of the extended constrained global types and examples of their use, in the different contexts of fail-uncontrolled and AmI systems.
	Bonanno F.; Capizzi G.; Lo Sciuto G.	Mobile agents with recurrent neural networks-based computing model for echo cancellation problem	2015	The purpose of this paper is to draw attention to a novel solving method for AEC problem and to search for a solution based on mobile agents (MAs) technology. Several applications benefit already by the use of MAs technology and we now want to join a soft computing technology as recurrent neural networks (RNNs) for this problem's area in communication systems. In this paper we propose a MAs with RNNs-based, so as pipelined recurrent neural networks (PRNNs), computing model for AEC's problem in communication systems. Prediction of echo paths can be performed by RNNs and PRNNs based processing. The results about the faced problem in communication systems, where the use of MAs with RNNs implementation might be an improvement over a more conventional solutions, are here summarized, presented and evaluated. Satisfactory performance in echo cancellation were obtained. The two echo signals input, as echo remote and echo local are provided as inputs to the RNN and PRNN and the echo output prediction shows a relevant reduction evaluated as 60 db.
	Caianiello P.; Presutti D.	A case study on goal oriented obstacle avoidance	2015	We report on several test experiments with a mobile agent equipped with an artificial neural net control to achieve a basic route direction goal reflex in a 2-dimensional environment with obstacles. A real assembled 4 tronix Initio robot kit agent is reproduced with its sensor and motor characteristics in a virtual environment for experimenting and comparing the behavior of its artificial neural net control with two different learning approaches: A standard supervised error back propagation training with examples, and an unsupervised reinforcement learning with environmental feedback.
	Murano A.; Sorrentino L.	A game-based model for human-robots interaction	2015	Game theory has exhibited to be a fruitful metaphor to reason about multi-player systems. Two kinds of games are mainly studied and adopted: turn-based and concurrent. They differ on the way the players are allowed to move. However, in real scenarios, there are very simple interplays among players whose modeling does not fit well in any of these settings. In this paper we introduce a novel game-based framework to model and reason about the interaction between robots and humans. This framework combines all positive features of both turn-based and concurrent games. Over this game model we study the reachability problem. To give an evidence of the usefulness of the introduced framework, we use it to model the interaction between a human and a team of two robots, in which the former tries to run away from the latter. We also provide an algorithm that decides in polynomial time whether at least one robot catches the human.
	Busetta P.; Dragoni M.	Composing cognitive agents from behavioural models in PRESTO	2015	The PRESTO project applies agent technologies to serious gaming. PRESTO has developed an AI infrastructure and an agent framework called DICE for the creation of game-independent, modular Non-Player Characters (NPC) behaviours based on a BDI (Belief-Desire-Intention) approach enriched with cognitive extensions for human simulation. Behavioural models can be combined via end-user development tools to form the behavioural profiles of NPCs in a game. DICE provides the coordination between body-controlling behavioural models (for navigation as well as posture, facial expressions, actioning) and decision-making models representing e.g. the standard operating procedures of professional roles, the cognitive appraisal of events and perceptions, the modality of reaction to unplanned events occurring during a game. Behavioural models are largely if not completely independent of the specific scenario or even game engine thanks to abstractions of both the environment and the internal state of the NPC provided by means of ontologies. PRESTO is producing a set of behavioural models targeted at its pilot project's needs or expected to be of common use, including navigation in the virtual environment sensitive to the cognitive state of the NPC. This paper gives a brief overview of PRESTO, DICE and of its ontologies.
	Poggi A.	Agent based modeling and simulation with ActoMoS	2015	ActoMoS is an actor-based software library for the development of agent-based models and for their simulation. This library offers software components and tools for modeling and simulating systems in different application domains. In particular, it allows the definition of agent model by reusing or extending a set of predefined agent models and supports efficient and scalable agent-based simulations involving a large number of agents. This paper, after an introduction of the actor model and implementation used by the software library, underlines the main features of the software library and presents its experimentation in some well-known domains.
	Caruso D.; Giunta R.; Messina D.; Pappalardo G.; Tramontana E.	Rule-based location extraction from Italian unstructured text	2015	Named entity recognition is a wide research topic concerned with the extraction of information from unlabelled texts. Existing approaches mainly deal with the English language, in this paper we present the results of a novel approach specifically tailored to the Italian language. The approach is directed at recognising location names in unstructured texts by several agents based on rules devised for the Italian grammar. Preliminary results show an F1 score up to 0.67.
	Fornacciari P.; Mordonini M.; Tomaiuolo M.	A case-study for sentiment analysis on twitter	2015	Microblogging platforms like Twitter can convey short messages to direct contacts, but also to other potentially interested users. They are actively exploited either by individual users or whole organizations and companies. This paper describes some results we obtained from the Social Network and Sentiment Analysis of a Twitter channel, related to a pop music event. Apart from the particular results, a methodology and some guidelines for the automatic classification of Twitter content are discussed.
	Sapienza A.; Falcone R.; Castelfranchi C.	The positive power of prejudice: A computational model for MAS	2015	In MAS studies on Trust building and dynamics the role of direct/personal experience and of recommendations and reputation is proportionally overrated; while the importance of inferential processes in deriving the evaluation of trustees' trustworthiness is underestimated and not enough exploited. In this paper we focus on the importance of generalized knowledge: agents' categories. The cognitive advantage of generalized knowledge can be synthesized in this claim: "It allows us to know a lot about something/somebody we do not directly know". At a social level this means that I can know a lot of things on people that I never met; it is social "prejudice" with its good side and fundamental contribution to social exchange. In this study we experimentally inquire the role played by categories' reputation with respect to the reputation and opinion on single agents: when it is better to rely on the first ones and when are more reliable the second ones. Our claim is that: the larger the population and the ignorance about the trustworthiness of each individual (as it happens in an open world) the more precious the role of trust in categories. In particular, we want investigate how the parameters defining the specific environment (number of agents, their interactions, transfer of reputation, and so on) determine the use of categories' reputation. This powerful inferential device has to be strongly present in WEB societies.
