Discussed	Authors	Title	Year	Abstract
	Magnolo E.; Manenti L.; Manzoni S.; Sartori F.	Towards a MAS model for crowd simulation at pop-rock concerts exploiting ontologies and fuzzy logic	2009	This paper illustrates a formal method to support crowd profiling phase into the development of Multi Agent Systems model. After a discussion about crowd reasearch context, a methodological tool for crowd classification based on a sociological theory is proposed. The tool uses an ontology based on fuzzy logic and allows the analysis of different crowded scenarios according to crowd features (e.g. density, duration, and so on). In particular it is illustrated the use of this method in relation to concert scenarios. Finally, an interpretation of this scenario, according to agent theory, is given.
	Baldoni M.; Boella G.; Grenna R.	Modeling organizations and roles using a middleware Jade-based	2009	Organizations and roles are often seen as mental constructs, good to be used during the design phase in Multi Agent Systems, but they have also been considered as first class citizens in MAS, when objective coordination is needed. Roles facilitate the coordination of agents inside an organization, and they give new abilities in the context of organizations, called powers, to the agents which satisfy the requirements necessary to play them. No general purpose programming languages for multiagent systems offer primitives to program organizations and roles as instances existing at runtime, so, in this paper, we propose our extension of the Jade framework, with primitives to program in Java organizations structured in roles, and to enable agents to play roles in organizations.We provide classes and protocols which enable an agent to enact a new role in an organization, to interact with the role by invoking the execution of powers, and to receive new goals to be fulfilled. Since roles and organizations can be on a different platform with respect to the role players, the communication with them happens via protocols. Since they can have complex behaviours, they are implemented by extending the Jade agent class. Our aim is to give to programmers a middle tier, built on the Jade platform, useful to solve with minimal implementative effort many coordination problems, and to offer a first, implicit, management of norms and sanctions.
	Castelli G.; Zambonelli F.	A self-organized multiagent approach for distributed management of contextual data	2009	Pervasive computing devices are able to generate enormous amounts of data, from which knowledge about situations and facts occurring in the world should be inferred for the use of pervasive services. However accessing and managing effectively such a huge amount of distributed information is challenging for services. In this paper we propose a self-organized approach to autonomously organize distributed contextual data items into sorts of knowledge networks. Knowledge networks are conceived as an alive self-organized layer in charge of managing data, that can facilitate services in extracting useful information out of a large amount of distributed items. We motivate our approach and present the W4 Data Model that we used to represent contextual data. On these basis, we introduce the general idea of W4 Knowledge Networks and we detail the specific bio-inspired approach for self-organized networking of data items. A case study is introduced to clarify the concepts expressed, and experimental results are reported to support our arguments and proposal.
	Boella G.; Cerisara A.; Grenna R.	Roles in building web applications using Java	2009	In this paper we apply the powerJava model of roles and relationships to a web application programming environment. First we show how the notion of role, as defined in powerJava, combines and automates several aspects which are important in web application programming, and which are now unrelated and dealt with separately and mostly by hand, and thus prone to errors. Second we show how from the powerJava code a web application can be automatically constructed using Struts and Spring.
	Puviani M.; Cabri G.; Leonardi L.	The future of AOSE: Exploiting SME for a new conception of methodologies	2009	In the last years, the software engineering field has provided developers with different methodologies to support their work. Nevertheless, existing methodologies can hardly meet the requirements of all existing scenarios, which are more and more complex and highly differentiated. This problem can be faced by applying the Situational Method Engineering (SME) approach, which enables to build appropriate methodologies by composing "fragments" of existing ones. We envision this approach as the future of software engineering in general, and in particular if applied in Agent Oriented Software Engineering (AOSE). This approach has also the valuable advantage of reusing models, solutions, experiences and tools of existing and tested methodologies. In this paper we report three examples of application of the Situational Method Engineering approach in AOSE. We show that this approach can be applied following different directions, and in particular: entity-driven, metamodel-driven, and characteristic-driven. To concretely show these directions, we present three examples of methodologies for developing agent systems (one regarding self-organising systems), all constructed composing methodology fragments to meet the scenario requirements.
	Piunti M.; Ricci A.; Santi A.	SOA/WS applications using cognitive agents working in CArtAgO environments	2009	In this paper we propose a programming model and the supporting technologies for designing and programming Service-Oriented Architectures (SOA) in the perspective of Multi-Agent Systems and agent-oriented paradigms. In particular, the approach is meant to be useful for the design and programming of complex service-oriented systems, by providing first-class design tools to implement challenging features of nextcoming service applications. Indeed, besides autonomy, loose-coupled interactions, openness, flexibility, etc., the proposed design model promotes: (i) the use of a strong notion of agency, thus agents that can be defined along their mental attitudes to be fully autonomous systems, with pro-active and goal oriented abilities with respect of the achievement of their tasks; (ii) the definition artifact-based work environments where agents are meant to work and interact, thus enabling intelligent and cognitive agents to co-use, expose and manage web service technologies in a suitable functional fashion by the mean of special artifactbased infrastructures. Besides describing the basic concepts underlying the agent and artifact programming model for web services, a developing platform called CArtAgO-WS is introduced along with a describing example explored to show the approach in practice.
	Chella A.; Cossentino M.; Seidita V.	Towards the adoption of a perception-driven perspective in the design of complex robotic systems	2009	Awareness and autonomous interaction with the environment in a robotic system is the base of the new discipline of machine consciousness. In this paper we present the results of a first attempt in order to engineer these robotic systems by applying a Situational Method Engineering approach that extends PASSI and to create a model for conscious systems.
	Chesani F.; Mello P.; Montali M.; Torroni P.	A REC-based commitment tracking tool	2009	[No abstract available]
	Aversa  R.; Beniamino D.M.; Moscato F.; Venticinque S.	Modeling and verification of real-time multi-agent systems: The REMM framework; [Modellazione e verifica di sistemi multi-agente real-time: Il framework REMM]	2009	[No abstract available]
	Poggi A.	Towards a flexible development framework for multi-agent systems	2010	In this paper, we present a software framework, called HDS (Heterogeneous Distributed System), that tries to simplify the realization of distributed applications and, in particular, of multi-agent systems, by: i) abstracting the use of different technologies for the realization of distributed applications on networks of heterogeneous devices connected through a set of different communication transport protocols, ii) merging the client-server and the peer-to-peer paradigms, and iii) implementing all the interactions among the processes of a system through the exchange of typed messages that allow the implementation of a large set of communication protocols and languages.
1	Zambonelli F.; Viroli M.	From service-oriented architectures to nature-inspired pervasive service ecosystems	2010	Emerging pervasive computing scenarios require open service frameworks promoting situated adaptive behaviors and supporting diversity in services and long-term evolvability. We argue that this naturally calls for a nature-inspired approach, in which pervasive services are modeled and deployed as autonomous individuals in an ecosystem of other services, data sources, and pervasive devices. As an evolution of standard service-oriented architectures, we present a general framework framing the concepts expressed, and discuss a number of natural metaphors that we can adopt to concretely incarnate the proposed framework and implement pervasive service ecosystems.
	Grosso A.; Anghinolfi D.; Boccalatte A.; Cannata G.	A context aware multi-robot coordination system based on agent technology	2010	This paper presents an approach for multi-robot coordination based both on coordinated navigation and task allocation method. An ad hoc agent based architecture is defined in order to implement the robot control system in both simulation and real applications. The coordination of the multi-robot system is based on agent interaction and negotiation, and a communication infrastructure based on open web standards is provided. The system employs the RFID technology for building a context aware information system which is the base of the coordination strategies.
1	Fortino G.; Galzarano S.	Programming Wireless Body Sensor Network applications through agents	2010	Wireless Sensor Networks (WSNs) are currently emerging as one of the most disruptive technologies enabling and supporting next generation ubiquitous and pervasive computing scenarios. In particular, Wireless Body Sensor Networks (WBSNs) are conveying notable attention as their real-world applications aim at improving the quality of human beings life by enabling continuous and real-time non-invasive assistance at low cost. This paper proposes a high-level programming approach based on the agent-oriented model to flexibly design and efficiently implement WBSNs applications. The approach is exemplified through a case study concerning a real-time human activity monitoring system which is developed through two different agent-based frameworks: MAPS (Mobile Agent Platform for Sun SPOT) and AFME (Agent Factory Micro Edition). The programming effectiveness of MAPS and AFME with respect to the developed systems is finally discussed.
1	Nardini E.; Viroli M.; Casadei M.; Omicini A.	A self-organising infrastructure for chemical-semantic coordination: Experiments in TuCSoN	2010	Recent works proposed the adoption of a natureinspired approach of chemistry for implementing service architectures suitable for pervasive applications [34]. In particular, [31] proposes a chemical-semantic tuple-space model where coordination of data, devices and software agents - representing the services of the pervasive computing application - are reified into proper tuples managed by the coordination infrastructure. Service coordination is enacted by chemical-like reactions that semantically match those tuples accordingly enacting the desired interaction patterns (composition, aggregation, competition, contextualisation, diffusion and decay). After showing and motivating the proposed coordination approach for situated, adaptive, and diversity-accomodating pervasive computing systems, in this paper we outline how it is possible to concretise the approach on the TuCSoN coordination infrastructure, which can been suitably enhanced with modules supporting fuzzy semantic-coordination and execution engine for chemical-inspired coordination laws.
	Manenti L.; Manzoni S.; Vizzari G.; Ohtsuka K.; Shimura K.	Towards an agent-based proxemic model for pedestrian and group dynamic	2010	Models for the simulation of pedestrian dynamics and crowds of pedestrians have already been successfully applied to several scenarios and case studies, off-the-shelf simulators can be found on the market and they are commonly employed by end-user and consultancy companies. However, these models are the result of a first generation of research efforts considering individuals, their interactions with the environment and among themselves, but generally neglecting aspects like (a) the impact of cultural heterogeneity among individuals and (b) the effects of the presence of groups and particular relationships among pedestrians. This work is aimed, on one hand, at clarifying some fundamental anthropological considerations on which most pedestrian models are based, and in particular Edward T. Hall's work on proxemics. On the other hand, the paper will briefly describe the first steps towards the definition of an agentbased model encapsulating in the pedestrian's behavioural model effects capturing both proxemics and influences due to potential presence of groups in the crowd.
	Falcone R.; Castelfranchi C.	Transitivity in trust: A discussed property	2010	Transitivity in trust is very often considered as a quite simple property, trivially inferable from the classical transitivity defined in mathematics, logic, or grammar. In fact the complexity of the trust notion suggests evaluating the relationships with the transitivity in a more adequate way. In this paper, starting from a socio-cognitive model of trust, we analyze the different aspects and conceptual frameworks involved in this relation and show how different interpretations of these concepts produce different solutions and definitions of trust transitivity.
	Santi A.; Guidi M.; Ricci A.	Exploiting Agent-Oriented Programming for developing Android applications	2010	Agent-Oriented Programming (AOP) provides an effective level of abstraction for tackling the programming of mainstream software applications, in particular those that involve complexities related to concurrency, asynchronous events management and context-sensitive behaviour. In this paper we support this claim in practice by discussing the application of AOP technologies - Jason and CArtAgO in particular - for the development of smart nomadic applications based on the Google Android platform.
	Franchi E.	A multi-agent implementation of social networks	2010	In this paper, we present a multi-agent system implementing a fully distributed Social Network System supporting user profiles as FOAF profiles. This system is built around the idea that users should be the sole owners of the information they provide (either consciously or unconsciously) and addresses privacy issues by design, also minimizing the amount of information users have to disclose in order to make new friends. Users are represented by agents that both mediate access to private data and proactively negotiate with other agents in order to extend their user's social network. We also present the distributed connection discovery algorithm used by the agents and detail the representation of data in the users' profiles used to support the algorithm. The design is rather agnostic about the layer responsible for the communication technology; here we present a possible implementation on the top of the HDS software framework.
	Bergenti F.; Vargiu E.	Multi-agent systems in the industry three notable cases in Italy	2010	This paper reports on three notable examples of the use of multi-agent systems in the Italian Industry. First, we introduce the topic and we outline some examples of real-world agent-based software application. Then, we describe in details the use of multi-agent systems in three software packages for (i) personalized press reviews, (ii) monitoring boats in marine reserves, and (iii) advanced contact centers. Finally, we draw some conclusions and summarize the lesson learnt from described experiences. The discussion focuses on the benefits and problems that the choice of agent technology brought.
1	Piunti M.; Ricci A.; Boissier O.; Hübner J.F.	Programming open systems with agents, environments and organizations	2010	MAS research pushes the notion of openness related to systems combining heterogeneous computational entities. Typically, those entities answer to different purposes and functions and their integration is a crucial issue. Starting from a comprehensive approach in developing agents, organizations and environments, this paper devises an integrated approach and describes a unifying programming model. It introduces the notion of embodied organization, which is described first focusing on the main entities as separate concerns; and, second, establishing different interaction styles aimed to seamlessly integrate the various entities in a coherent system. An integration framework, built on top of Jason, CArtAgO andMoise (as programming platforms for agents, environments and organizations resp.) is described as a suitable technology to build embodied organizations in practice.
	Montagna S.; Omicini A.; Ricci A.	A multiscale agent-based model of morphogenesis in biological systems	2010	Studying the complex phenomenon of pattern formation created by the gene expression is a big challenge in the field of developmental biology. This spatial self-organisation autonomously emerges from the morphogenetic processes and the hierarchical organisation of biological systems seems to play a crucial role. Being able to reproduce the systems dynamics at different levels of such a hierarchy might be very useful. In this paper we propose the adoption of the agent-based model as an approach capable of capture multi-level dynamics. Each cell is modelled as an agent that absorbs and releases substances, divides, moves and autonomously regulates its gene expression. As a case study we present an agent-based model of Drosophila melanogaster morphogenesis. We then propose a formalisation of the model which clearly describe its main components. We finally show simulation results demonstrating the capability of the model of reproducing the expression pattern of the embryo.
	MacCagnan A.; Vardanega T.; Feltriny E.; Valley G.; Rivaz M.; Cannatax N.	A Multi-Agent System for the automated handling of experimental protocols in biological laboratories	2010	Software-based Laboratory Information Management Systems can handle samples, plates, instruments, users, potentially up to the automation of whole workflows. One frustrating element of this predicament is that Life Sciences laboratory protocols are normally expressed in natural languages and thus are scarcely amenable to real automation. We want to defeat this major limitation by way of a project combining Model-Driven Engineering, Workflows, Ontologies and Multiagent systems (MAS). This paper describes the latter ingredient. Our MAS has been implemented with JADE and WADE to automatically interpret and execute a structured representation of laboratory protocols expressed in XPDL+OWL. Our work has recently been tested on a real test case and will shortly be deployed in the field.
1	Baldoni M.; Baroglio C.; Bergenti F.; Boccalatte A.; Marengo E.; Martelli M.; Mascardi V.; Padovani L.; Patti V.; Ricci A.; Rossi G.; Santi A.	MERCURIO: An interaction-oriented framework for designing, verifying and programming multi-agent systems (position paper)	2010	This is a position paper reporting the motivations, the starting point and the guidelines that characterise the MERCURIO 1 project proposal, submitted to MIUR PRIN 2009 2. The aim is to develop formal models of interactions and of the related support infrastructures, that overcome the limits of the current approaches by explicitly representing not only the agents but also the computational environment in terms of rules, conventions, resources, tools, and services that are functional to the coordination and cooperation of the agents. The models will enable the verification of interaction properties of MAS from the global point of view of the system as well as from the point of view of the single agents, due to the introduction of a novel social semantic of interaction based on commitments and on an explicit account of the regulative rules.
	Fichera L.; Marletta D.; Nicosia V.; Santoro C.	A methodology to extend imperative languages with AgentSpeak declarative constructs	2010	This paper presents a novel technique for the support of declarative constructs of AgentSpeak in a imperative language. Starting from an analysis of the characteristics and semantics of AgentSpeak, as well as the requirements of an AgentSpeak implementation, the paper proposes a framework which, by exploiting object-orientation and operator overloading, is able to enrich an imperative language with declarative constructs suitable to represent and write AgentSpeak programs. A concrete implementation of the proposed framework is then given by presenting PROFETA (Python RObotic Framework for dEsigning sTrAtegies), a tool written in Python which adds to this language the capability to write and execute AgentSpeak plans. A case-study shows how PROFETA can be used to easily write strategies for an autonomous mobile robot, designed by the authors for the "Eurobot 2010" international robotic competition.
	Molesini A.; Omicini A.	Documenting SODA: An evaluation of the process documentation template	2010	This paper presents an experimental evaluation of the methodology documentation template proposed by the IEEE FIPA Design Process Documentation and Fragmentation working group [1]. Generally aimed at agent-oriented methodologies, the template is here put to the test by documenting the SODA methodology, so as to obtain a partial but significant evaluation of the template's strengths and weaknesses.
	Ferrari L.; Mamei M.	Classification of whereabouts patterns from large-scale mobility data	2010	Classification of users' whereabouts patterns is important for many emerging ubiquitous computing applications. Latent Dirichlet Allocation (LDA) is a powerful mechanism to extract recurrent behaviors and high-level patterns (called topics) from mobility data in an unsupervised manner. One drawback of LDA is that it is difficult to give meaningful and usable labels to the extracted topics. We present a methodology to automatically classify the topics with meaningful labels so as to support their use in applications. This mechanism is tested and evaluated using the Reality Mining dataset consisting of about 350000 hours of continuous data on human behavior.
	Tranquillin M.; Ferrari C.; Moro M.	Using mobile agents for secure biometric authentication	2010	This paper deals with the definition of a strong authentication model, coupling usual password/PIN based methods with a biometric matching, over a Multi Agent distributed infrastructure. When the user authentication procedure involves personal devices, the Multi Agent System model helps in the distribution of data and algorithms thanks to a better partitioning of roles and responsibilities, enhancing robustness to eavesdropping and tampering by properly moving agents around the system itself. The system architecture is based on specialized agents tied to the different devices, which safely communicate using both symmetric encryption for messages and asymmetric encryption to check principals' roles. Moreover, agents can carry on biometric parameters matching algorithms, bringing computation on those nodes with enough computing power. A complete authentication protocol has been developed and two different demos have been devised and tested. They differ for the tasks assigned to the mobile devices in use. Experiments show that agent capabilities, together with their power of migration, help in maintaining a higher level of security when mobile devices are involved.
1	Messina F.; Pappalardo G.; Santoro C.	A self-organising system for resource finding in large-scale computational grids	2010	This paper presents a novel approach for resource finding and job allocation in a computational Grid. The proposed system is called HYGRA, for HYperspace-based Grid Resource Allocation. The basic principle involves the construction of a virtual hyperspace in which the available amount of each resource type is used as a geometric coordinate, making each Grid node representable as a point in this virtual hyperspace. A distributed overlay construction algorithm aims at connecting each node with the nearest k nodes w.r.t. the euclidean distance defined in the hyperspace. In this system, a job request, which can be also represented as a point, navigates the hyperspace, from node to node, following the overlay links which minimize the euclidean distance between the current node and the target point representing the job itself. The paper describes the algorithms for overlay construction and resource finding and assesses their validity and performances by means of a simulation approach.
