Discussed	Authors	Title	Year	Abstract
	Briola D.; Mascardi V.; Gioseffi M.	OntologyBeanGenerator 5.0: Extending ontology concepts with methods and exceptions	2018	When modeling and implementing complex systems based on agents and artifacts, achieving semantic interoperability is not only useful, but often necessary. A commonly adopted solution to manage complex and real MASs is adopting a Model Driven methodology, which uses an ontology as the formal representation of the domain, and then exploiting some existing tool to automatically generate code for agents in the MAS, to let them interact according to the model. While this approach is satisfactorily supported when the target MAS environment is Jason, less support is provided to Jade MASs, despite Jade's large adoption for real MASs development. So, considering the great support given by the automatic code generation starting from a formal model, and the large community working on Jade MASs, in this work we present an extension of the OntologyBeanGenerator plugin for Protégé, used to generate a Java representation of an OWL ontology for Jade. We improved the OntologyBeanGenerator tool to support the modeling of exceptions, formalized at the ontology level, and of methods associated with ontology elements, to set the interface of concrete objects (artifacts) at design stage. This extension allows us to integrate in a Model Driven approach a support for the formal definition of artifacts and provide an automatic generation of Jade code/interfaces to interact with them respecting the model. © Copyright 2018 for the individual papers by the papers' authors.
	Cossentino M.; Lopes S.; Nuzzo A.; Renda G.; Sabatucci L.	A comparison of the basic principles and behavioural aspects of Akka, Jacamo and Jade development frameworks	2018	Akka, JaCaMo, and Jade are three Java-based frameworks for agent/actor system programming. They present substantial differences both in the reference models and the behavioural aspects of the main entities (actors vs agents). The objective of this work is to compare the basic principles and behavioural aspects of these three frameworks, also giving an overview of other comparison categories in which we briefly discuss other criteria like reasoning and knowledge, interaction/communication model, sociality. In each sub-category, the characteristics of the three frameworks will be analysed, and finally, the relative differences will be discussed. The analysis highlights a substantial difference between Akka actor-based system and agent-based ones, such as JaCaMo and Jade. The results of the analysis reveal that each framework has some competitive advantages over the others. In particular, the orientation to the reasoning and the pro-activity of the agents, the presence of native tools for communication and ontology and the predisposition to the widespread deployment of the code require a careful analysis of the software requirements for the choice of the most suitable framework. © Copyright 2018 for the individual papers by the papers' authors.
	Ancona D.; Ferrando A.; Mascardi V.	Agents interoperability via conformance modulo mapping	2018	We present an algorithm for establishing a flexible conformance relation between two local agent interaction protocols (LAIPs) based on mappings involving agents and messages, respectively. Conformance is in fact computed "modulo mapping": two LAIPs τ and τ may involve different agents and use different syntax for messages, but may still be found to be conformant provided that a given map from entities appearing in τ to corresponding entities in τ is applied. LAIPs are modelled as trace expressions whose high expressive power allows for the design of protocols that could not be specified using finite state automata or equivalent formalisms. This expressive power makes the problem of stating if τ conforms to τ undecidable. We cope with this problem by over-approximating trace expressions that may lead to infinite computations, obtaining a sound but not complete implementation of the proposed conformance check. © Copyright 2018 for the individual papers by the papers' authors.
	Sarné G.M.L.	A reputation agent model for reliable vehicle-to-vehicle information	2018	In the next future, an incredible amount of objects will be mutually interconnected to exchange information and services to realize more and more complex tasks. Unfortunately, this process places significant risks on the interconnected objects and their users, due to the adoption of unreliable information sources. Consequently, an emerging issue is of improving this aspect. In open and dynamic software agent contexts, this is a relevant question given the agents capability to quickly evaluate the potential effects of a greatest number of malicious behaviors in automated way. The adoption of authentication techniques is unable to assure the reliability of the information sources, differently from trust and reputation systems that fit well with such problems. The reliability of the information sources is becoming relevant also in the context of urban mobility where vehicles could acquire information coming not only from the infrastructures but also from other vehicles. Reliable information sources are fundamental to contribute in reducing the negative traffic effects in urban centers, which is among the most important factors affecting citizens' life quality. In the above scenario, we designed a distributed reputation model, working within an agent framework, to assure the reliability of the information sources in vehicle-to-vehicle interactions. In particular, the designed reputation model is able to detect malicious and cheating information sources as shown by some preliminary simulations carried out on a simple urban test network. © Copyright 2018 for the individual papers by the papers' authors.
	Ciatto G.; Calegari R.; Mariani S.; Denti E.; Omicini A.	From the blockchain to logic programming and back: Research perspectives	2018	The blockchain is a novel approach to support distributed systems enabling a common, consistent view of a shared state among distributed nodes. There, smart contracts are computer programs that allow users to deploy arbitrary computations, in charge of automatically regulate state transitions and enforce properties. In this paper we speculate on how the blockchain and smart contracts could take advantage of a logic programming approach, and, complementarily, on how logic programming can benefit from the blockchain infrastructure. Accordingly, we discuss some possible research directions and open questions for future research. © Copyright 2018 for the individual papers by the papers' authors.
1	Rossi S.; Ercolano G.; Raggioli L.; Valentino M.; Di Napoli C.	A framework for personalized and adaptive socially assistive robotics	2018	Assistive technology is playing a crucial role in supporting caregivers and patients with neurological disorders to carry out home care services. Nevertheless, the technological advances allowing for the automation of such services often lead to systems composed of several devices that make patients not always comfortable when interacting with them, so limiting their effective use. In order to improve the acceptance level of an assistive system, a robotic system is proposed to act as a smart sensor whose functionalities to control its behavior as well as to provide meaningful observations from the input data are modeled as services. The system is supported by a middleware able to automatically schedule a set of home care services that are personalized for each patient considering the personal daily routine, the cognitive status, and the personality profile. In addition, the proposed system is able to react to dynamic changes in the patient's state by modifying the robot behavior and adapting on the fly the set of proposed home care services. © Copyright 2018 for the individual papers by the papers' authors.
	D'Urso F.; Santoro C.; Santoro F.F.	Integrating heterogeneous tools for physical simulation of multi-unmanned aerial vehicles	2018	This paper presents a multi-layer software architecture to simulate, in a accurate and realistic way, a set of unmanned aerial vehicles (UAVs) operating in a specific mission. A set of tools are employed, each one to simulate a specific part of the overall UAV hardware and software structure: a 3D visualization engine, a physical simulator, the flight stack and a network simulator to handle interactions among UAVs. A software architecture able to orchestrate and coordinate such tools is proposed, based on multiple layers of processes divided into two categories. The described approach is based on a protocol system for exchanging messages to synchronize the various simulation tools. The simulation of the unmanned aerial vehicles can therefore be performed on a single machine or distributed on several machines in order to create a distributed simulation and spread the workload. In this way, it is possible to simulate the behavior of the UAVs and also to reason about the problems due to network communications. © Copyright 2018 for the individual papers by the papers' authors.
	Crociani L.; Vizzari G.; Bandini S.	Between avoidance and imitation: Plausible wayfinding in pedestrian agent-based models	2018	Extending the range of pedestrian decision making activities represented in a simulation model represents a serious challenge: different decisions are taken at distinct levels of abstraction, employing different types of information and knowledge about the environment, from path planning to the regulation of distance from other pedestrians and obstacles present in the environment. Pedestrians, moreover, are not robots: although empirical observations show that they consider congestion when planning, there are evidences that their decisions are not always optimal (even in normal situations). We present a model integrating and improving consolidated results mitigating the optimization effects of congestion aware path planning by making commonsense estimations of the effects of perceivable congestion, also embedding an imitation mechanism stimulating changes in planned decisions whenever another nearby pedestrian did the same. The model is formally described and experimented both in a validation scenario as well as in a real-world situation: an interesting counterintuitive result, in which reducing available choices and exits actually reduces overall egress time, is also presented and discussed. © Copyright 2018 for the individual papers by the papers' authors.
1	Ruta M.; Scioscia F.; Loseto G.; Gramegna F.; Pinto A.; Di Sciascio E.	Semantic-based social intelligence through multi-agent systems	2018	Current technologies and market solutions are far from fulfilling the Ambient Intelligence (AmI) vision of simplified people-environment interactions. Even though Despite recent solutions based on Internet of Things (IoT) technologies provide the needed infrastructure, most approaches suffer from inadequate levels of intelligence and autonomy. This paper proposes a novel semantic-based Multi-Agent System (MAS) framework complying with the emerging Social Internet of Things paradigm devoted to improve both automation and adaptivity: device agents self-organize in social relationships, interacting autonomously and sharing information, cooperating and orchestrating ambient resources. A service-oriented architecture allows collaborative dissemination, discovery and composition of service/resource descriptions. Decision and choreography capabilities of software agents leverage Semantic Web languages at the knowledge representation layer and a mobile-oriented implementation of non-standard inferences for semantic matchmaking. Benefits of the proposal are highlighted through an AmI case study in the field of Home and Building Automation (HBA). A comparison with the state of the art is also provided. © Copyright 2018 for the individual papers by the papers' authors.
1	Calegari R.; Ciatto G.; Mariani S.; Denti E.; Omicini A.	Logic programming in space-time: The case of situatedness in LPaaS	2018	Situatedness is a fundamental requirement for today's complex software systems, as well as for the computational models and programming languages used to build them. Spatial and temporal situatedness, in particular, are essential features for AI, enabling actors of the system to take autonomous decisions contextual to the space-time they live in. To support spatiotemporal awareness in distributed pervasive systems, we adopt the standpoint of Logic Programming (LP) by focussing on the Logic Programming as a Service (LPaaS) approach, promoting the distribution of situated intelligence. Accordingly, we provide an interpretation about what it means to make LP span across space and time, then we extend the LPaaS model and architecture towards spatio-temporal situatedness, by identifying a set of suitably-expressive spatio-temporal primitives. © Copyright 2018 for the individual papers by the papers' authors.
	Comi A.; Fotia L.	Combining reliability, reputation and honesty to enhance QoS on federated computing infrastructures	2018	In this paper, we suggest an approach aimed at maximising the "global utility"(i.e., QoS) perceived into a large-scale federated computing infrastructures. Our approach computes the node and starts a procedure for the formation of coalitions between them. In particular, it is based on a trust model that allows actors to quantify the trustworthiness of their peers, and on a decentralised procedure that allows the Computing Federation to optimise the QoS. We define the generic SLA-based federated architecture, that is the global QoS offered by the federation, and we describe the theoretical foundation on which our proposal is based. Finally, we illustrate the experimental results which prove that the Global Capital of the Computing Federation improves. © Copyright 2018 for the individual papers by the papers' authors.
	Bergenti F.; Monica S.	A kinetic model of the dynamics of compromise in large multi-agent systems	2018	Compromise is one of the primary phenomena that govern the dynamics of the opinion in multi-agent systems. In this paper, compromise is isolated from other phenomena, and it is studied using a statistical framework designed to investigate collective properties of large multi-agent systems. The proposed framework is completed with the details needed to model compromise, and differential problems which describe the dynamics of the opinion under suitable hypotheses are presented. Long-time asymptotic solutions of obtained differential problems are discussed to confirm that compromise makes multi-agent systems tend to reach consensus. It is proved that compromise makes all agents tend to share the same opinion, and that the value of the asymptotic opinion can be expressed in terms of the characteristics of the multi-agent system and of the initial distribution of the opinion. Obtained analytic results are confirmed by independent simulations in an illustrative case. © Copyright 2018 for the individual papers by the papers' authors.
	Fotia L.	Recommending items in social networks using cliques-based trust	2018	Thematic groups are gaining a lot of attention and high centrality in online community, as users share opinions and/or mutually collaborate for reaching their targets. In this paper we consider the concept of clique in the social networks. A clique is a group of actors connected to each other more closely than the overall network of which they are a part. In the common language, the term clique means an informal and restricted social group formed by people who share common interests or characteristics. This paper proposes a new trust measure in social networks which focuses on cliques. In particular, we represent this scenario by means of a specific model, and we introduce an algorithm for detecting trust recommendations. We show a complete example of how our approach works. © Copyright 2018 for the individual papers by the papers' authors.
1	Chella A.; Lanza F.; Seidita V.	Representing and developing knowledge using Jason, CArtAgO and OWL	2018	Contexts where agents and humans are required to collaborate and cooperate in a human-like fashion are complex systems where a high degree of self-adaptability of every component is demanding. A fundamental ingredient when developing and implementing this kind of systems is the knowledge representation. Knowledge of the goals, the environment, other agents' capabilities and task and of itself, is crucial in deciding which action to perform to reach an objective and to behave in a self-adaptive way. The problem of knowledge modeling and representation becomes more and more urgent if the agents' operation domain changes at runtime. Knowledge has to be updated and handled while the system is in execution. In this paper, we present a way for implementing a controlled semantic system to manage the belief base of a multi-agent system at runtime. Our work is based on the development of a specific approach for interfacing Jason, CArtAgO and Jena; the knowledge base representation employs OWL Ontology. © Copyright 2018 for the individual papers by the papers' authors.
	Monica S.; Bergenti F.	Experiments on robust indoor localization of mobile devices using interval arithmetic	2019	The lack of techniques and tools to estimate the position of mobile devices with high accuracy and robustness is one of the major causes that limit the provision of advanced location-based services in indoor environments. An algorithm to enable mobile devices to estimate their positions in known indoor environments is discussed in this paper under the assumption that fixed network nodes are available at known locations. The discussed algorithm is designed to allow devices to estimate their positions by actively measuring the distances from visible fixed nodes. In order to reduce the errors introduced by the arrangement of the fixed nodes in the environment, the discussed algorithm transforms the localization problem into an optimization problem, which is then solved using interval arithmetic. Experimental results on the use of the discussed algorithm with distance estimates obtained using ultra-wide band are presented to assess the performance of the algorithm and to compare it with a reference alternative. Presented experimental results confirm that the discussed algorithm provides an increased level of robustness with respect to the considered reference alternative with no loss of accuracy. © 2019 CEUR-WS. All rights reserved.
	Cavallaro C.; Verga G.; Tramontana E.; Muscato O.	Multi-agent architecture for point of interest detection and recommendation	2019	Geographical positions are widely employed in many applications, such as recommendation systems. The wide-spread use of mobile devices and location-based Internet services (e.g., Google Maps) gives the opportunity to collect user locations. Taking advantage of a multi-agent system, this work proposes an approach providing users with personalised recommendations of places of interests, such as libraries, museum, restaurants, etc. The approach offers a better experience by giving additional dynamic data (e.g. popularity, as number of users) to a list of Points Of Interest (POIs), and by exploring their temporal relations. Indeed, for POIs, which we determine using a DBSCAN algorithm, we take into account the time slots when the users visited them, to offer a more advanced service. Finally, the approach was designed to preserve the privacy of users, i.e. it does not reveal the position of users. © 2019 CEUR-WS. All rights reserved.
	Cossentino M.; Lopes S.; Renda G.; Sabatucci L.; Zaffora F.	A metamodel of a multi-paradigm approach to smart cyber-physical systems development	2019	This paper illustrates an approach to the development of a shipboard power system reconfiguration as a Smart cyber-physical system (CPS). It is developed by representing it through a meta-model, providing a multi-paradigm approach that exploits the best features of three available frameworks, Jade, Jason and Akka. The resulting developing framework allows the creation of a new composite entity (labelled H-Entity) that exploits the advantages of Jade, Jason and Akka. © 2019 CEUR-WS. All rights reserved.
	Sapienza A.; Falcone R.	A theoretical model for the human-IoT systems interaction	2019	Thanks to the IoT, our life will strongly improve in the next future. However, it is not given that the users will be able to afford all the automation it will offer or that it will be compatible with the users’ cognitive attitudes and its actual and real goals. In this paper, we face the question of the IoT from the user point of view. We start analyzing which reasons undermine the acceptance of IoT systems and then we propose a possible solution. The first contribution of this work is the level characterization of the autonomy a user can grant to an IoT device. The second contribution is a theoretical model to deal with users and to stimulate users’ acceptance. By the means of simulation, we show how the model works and we prove that it leads the system to an optimal solution. © 2019 CEUR-WS. All rights reserved.
	Cantucci F.; Falcone R.	A computational model for cognitive human-robot interaction: An approach based on theory of delegation	2019	In this paper we present a cognitive model to support reasoning and decision making on socially adaptive task delegation and adoption. The designed model allows a robot to dynamically modulate to dynamically modulate its own level of collaborative autonomy, by restricting or expanding a received task delegation, on the basis of several context factors as the needs of other users involved in the interaction. We exploit principles underlying theory of delegation, theory of mind and BDI agent modelling, in order to build a decision making system for real-world teaming between autonomous agents. The model has been developed by using JaCaMo framework, which provides support for implementing multi-agent systems and integrates different multi-agent programming dimensions. We tested our model in a specific domain on the humanoid robot Nao, widely adopted in human-robot interaction applications. The support study has established that the model provides the robot with the ability to modify its social autonomy and to handle possible collaborative conflicts due to the initiative to help the user beyond her/his request. © 2019 CEUR-WS. All rights reserved.
	Postorino M.N.; Sarné G.M.L.	A preliminary study for an agent blockchain-based framework supporting dynamic car-pooling	2019	In the last decades, private cars caused an increasing growth of urban traffic flows all over the world with a consequent increase of environmental pollution and road congestion. In this context, Car-Pooling is an alternative car-based solution for private mobility that optimizes the car loading factor with respect to the number of passengers, although it requires that all the participants share trip origin and destination at the same time. To make the system more appealing, an on-demand service adopting variable fares on the basis of trip length and number of participants is proposed in this paper. Multi-agent, reputation and blockchain technologies are used and a suitable dynamic routing algorithm has been developed. Experiments on simulated data prove the potentiality of this approach. © 2019 CEUR-WS. All rights reserved.
	Ancona M.; Mascardi V.; Noceti N.; Odone F.; Ahsen W.; Scribellito A.	Towards the internet of safe and intelligent postal+ things	2019	SAFEPOST is an FP7 European project which was active from April 2012 to July 2016 aimed at the “reuse and development of Security Knowledge assets for International Postal supply chains”, as its full title explains. SAFEPOST addressed threats to postal security by designing and experimenting a sensor network detection system including gas, radiation, Raman spectroscopy and image-based sensors. In 2015, while SAFEPOST was running, the US Postal Service and IBM suggested the idea of applying sensors to the postal infrastructure components to bring the acquired data to the next supply chain level and optimize efficiency and costs, leading to an Internet of Postal Things. Merging the SAFEPOST and Internet of Postal Things approaches and applying the result of their merge to supply chains involving not only postal items, but also logistic infrastructures and business processes, paves the way to an Internet of Safe Postal+Things, IoSP+T. The IoSP+T can be further enriched and made smarter, more flexible, and intelligent, by adding agents below, inside, and on top of it. In this paper we provide our vision of the Internet of Safe and Intelligent Postal+ Things, IoSIP+T, highlighting challenges and opportunities. © 2019 CEUR-WS. All rights reserved.
	Alzetta F.; Giorgini P.	Towards a real-time BDI model for ROS 2	2019	In the race for automation, electronic devices are required to become more and more intelligent in order to make the correct choices in unforeseen situations without any need of human intervention. AI proposes basically two different approaches: machine learning algorithms and multi-agent systems. While the former perform very well when dealing with single, independent, computing units, multi-agent systems are more suitable in case of different components interacting with one another. In this paper, we propose a real-time multi-agent approach to improve practical reasoning, integrating the Belief-Desire-Intention model into one of the most popular robotics framework, ROS 2. © 2019 CEUR-WS. All rights reserved.
